{
  "id": "venture-product-core",
  "version": "1.0",
  "name": "Venture Product Core Kit",
  "summary": "Core standards and templates for PersonaKit macOS product discovery, planning, and tracking.",
  "essentialIds": [
    "venture-product-principles",
    "feature-brief-template",
    "roadmap-milestone-tracking-standard",
    "venture-product-quality-gate",
    "environment",
    "non-goals",
    "tools-and-constraints"
  ]
}
