{
  "id": "taskboard-parity-core",
  "version": "1.0",
  "name": "Taskboard Parity Core Kit",
  "summary": "Core parity checklist and workflow guidance for Trello-like Taskboard board and card execution.",
  "essentialIds": [
    "taskboard-board-card-parity-checklist",
    "planning-board-ux-patterns",
    "environment",
    "non-goals",
    "tools-and-constraints"
  ]
}
