{
  "id": "venture-studio-core",
  "version": "1.0",
  "name": "Venture Studio Core Kit",
  "summary": "Foundational guardrails for ethical opportunity discovery and selection.",
  "essentialIds": [
    "venture-studio-principles",
    "environment",
    "non-goals",
    "tools-and-constraints"
  ]
}
