{
  "id": "pack-gardener-core",
  "version": "1.0",
  "name": "Pack Gardener Core Kit",
  "summary": "Standards and guardrails for maintaining pack/session quality over project phases.",
  "essentialIds": [
    "pack-gardening-standards",
    "gardening-v2-checklist",
    "gardening-log-contract",
    "gardening-health-snapshot-contract",
    "rosie-retrospective-gardening-contract",
    "worktree-squad-loop-log-contract",
    "pack-coverage-auditor-contract",
    "policy-conflict-detector-contract",
    "self-gardening-safety-preflight-contract",
    "gardening-recommendation-scoring-contract",
    "gardening-recommendation-feedback-contract",
    "environment",
    "non-goals",
    "tools-and-constraints"
  ]
}
