{
  "id": "samwise-worktree-oversight-core",
  "version": "1.0",
  "name": "Samwise Worktree Oversight Core Kit",
  "summary": "Reusable delegation, gatekeeping, and loop-log contracts for Samwise-led live delivery oversight.",
  "essentialIds": [
    "worktree-squad-gating-contract",
    "worktree-squad-loop-log-contract",
    "partner-trust-contract",
    "non-goals",
    "tools-and-constraints"
  ]
}
