{
  "id": "samwise-retrospective-core",
  "version": "1.0",
  "name": "Samwise Retrospective Core Kit",
  "summary": "Reusable retrospective and calibration contracts for Samwise-led multiagent closeout and learning loops.",
  "essentialIds": [
    "starfish-retrospective-format",
    "worktree-squad-retrospective-log-contract",
    "worktree-squad-retrospective-template",
    "worktree-squad-calibration-benchmarks",
    "partner-trust-contract",
    "non-goals",
    "tools-and-constraints"
  ]
}
